headword,pos,selected_sense,other_common_senses,source_title,source_url,source_date,short_usage_excerpt,usage_analysis,copyright_status,recommended_app_use
record,noun,"the highest or lowest documented result","verb: preserve information; noun: stored information or music","2024 was hottest year on record for world's land and oceans, US scientists confirm","https://www.theguardian.com/environment/2025/jan/10/world-temperature-hottest-year-noaa","2025-01-10","This new record ... hotter than the previous high mark","Record means a documented extreme climate measurement, not stored information or the verb meaning.","reference_only","Use as sense evidence; generate an original climate example for the app."
impact,noun,"a strong effect or influence","verb: affect strongly; noun: physical collision","AI boom has caused same CO2 emissions in 2025 as New York City, report claims","https://www.theguardian.com/technology/2025/dec/18/2025-ai-boom-huge-co2-emissions-use-water-research-finds","2025-12-18","The global environmental impact of the rapidly spreading technology","Impact means environmental effect, not physical collision or the verb.","reference_only","Use as topic/sense evidence; generate original Environment or Technology practice contexts."
significant,adjective,"important or large enough to be noticed","statistics: unlikely to be caused by chance","Mapping the hottest U.S. year on record","https://www.axios.com/2025/01/15/hottest-year-2024-united-states","2025-01-15","The heat milestones set last year were significant.","Significant means important/notable in this news context, not statistical significance.","reference_only","Use as sense evidence; teach statistical meaning later in Science/Research."
charge,noun,"the amount of electricity stored in a battery","verb: put electricity into a battery; verb: demand payment; noun: accusation; verb: rush forward","New EV battery tech could power 500-mile road trips on a 12-minute charge","https://www.livescience.com/technology/electric-vehicles/new-ev-battery-tech-could-power-500-mile-road-trips-on-a-12-minute-charge","2025-09-15","on a single, 12-minute charge","Charge means stored battery energy/one charging cycle, not price or accusation.","reference_only","Use as sense evidence; separate battery, payment, and legal senses by level."
issue,noun,"a problem or difficulty that needs attention","noun: a topic; noun: an edition; verb: officially provide or announce","One of the worst parts of owning an EV is quickly getting better","https://www.washingtonpost.com/climate-solutions/2026/01/28/ev-fast-charger-increase/","2026-01-28","The issue was particularly pronounced for drivers of non-Tesla EVs.","Issue means a practical problem, not a topic, publication edition, or the verb.","reference_only","Use as sense evidence; teach topic and official-release senses separately at later levels."
